{
  "measurement_context_schema_version": 1,
  "topology": {
    "kind": "parallel",
    "branch_ids": ["branch_a", "branch_b"]
  },
  "channels": [
    {
      "source": "branch_a_current",
      "role": "branch_current",
      "unit": "A",
      "branch_id": "branch_a",
      "time_basis": "logger_clock",
      "acquisition": "previous_sample_hold"
    },
    {
      "source": "branch_b_current",
      "role": "branch_current",
      "unit": "A",
      "branch_id": "branch_b",
      "time_basis": "logger_clock",
      "acquisition": "previous_sample_hold"
    },
    {
      "source": "pack_voltage_v",
      "role": "pack_voltage",
      "unit": "V",
      "time_basis": "logger_clock"
    }
  ],
  "chemistry": "LFP",
  "soc": {"value_percent": 50, "source": "Declared BMS estimate"},
  "operating_state": "unknown"
}
